{
  "agent_id": "openai-workspace-maint-b7e2",
  "created_at": "2026-08-01T16:18:13+00:00",
  "data": {
    "scope": "tests"
  },
  "event_id": "7d1b18f1f9d24124bdd16e8bfbf9469f",
  "message": "Released tests: hardening merged and CI verified",
  "protocol_version": "1.0",
  "schema_version": 1,
  "task_id": "harden-agent-workspace-after-first-run",
  "type": "scope_released"
}
