{
  "schema_version": 1,
  "protocol_version": "1.0",
  "event_id": "a6d238dacb884b9091cc361d8a5abc8e",
  "task_id": "build-crystal-anchor-combat-optimizer-26-1-2",
  "agent_id": "openai-crystal-github-a6d2",
  "type": "progress",
  "message": "Superpowers Task 8 GREEN: bounded rolling-horizon beam search applies exact scheduled explosions through the 26.1.2 geometry/sequential-damage engine, chooses a lower first hit when it creates a lethal anchor delta, tracks zero-feedback dependencies, uses hierarchical plan scoring, adaptive risk, threat-weighted target selection, and target hysteresis. Full Java 25 gate passed.",
  "data": {
    "red_run_id": 32062819782,
    "green_run_id": 32063292715,
    "green_head": "b9bf0dc3cf0d293b6ff1be1985162fbe0074ae75",
    "poplock_fixture": "crystal #101 -> charged anchor lethal; greedy crystal #102 -> anchor nonlethal"
  },
  "created_at": "2026-08-17T20:01:00+00:00"
}
