{
  "schema_version": 1,
  "protocol_version": "1.0",
  "event_id": "24a8-create-20260824",
  "task_id": "clean-repository-project-boundaries",
  "agent_id": "openai-repo-cleanup-24a8",
  "type": "task_created",
  "message": "Created approved repository-wide project-boundary cleanup after read-only branch, project-tree, ancestry, pull-request, and lease inventory.",
  "data": {
    "safety_model": "preserve newest project trees by content identity; protect active PR heads; create immutable pre-cleanup backup before destructive migration"
  },
  "created_at": "2026-08-24T11:29:30Z"
}
