{"schema_version":1,"protocol_version":"1.0","task_id":"insect-release-9c3e","event_id":"9c3e-created","agent_id":"astra-insect-release-9c3e","type":"task_created","created_at":"2026-09-18T17:14:00+00:00","message":"User repeatedly requested finish plus immediate checkpoints. Corrected local source and actual GPU tests are preserved in delivered ZIPs. Native packages are not yet built. Existing original-root lease remains active, so publication uses a distinct release root.","data":{}}
