{
  "agent_id": "openai-workspace-repair-8c31",
  "created_at": "2026-08-18T11:21:00+00:00",
  "data": {
    "state": "open"
  },
  "event_id": "8c31a1f0b7e24a2f9e52c1d6e4f7086a",
  "message": "Reopened workspace hardening to repair recurring Git checkout validation failures",
  "protocol_version": "1.0",
  "schema_version": 1,
  "task_id": "harden-agent-workspace-after-first-run",
  "type": "task_state_changed"
}
