{
  "agent_id": "astra-insect-resume-m5r2",
  "created_at": "2026-09-19T01:34:10+00:00",
  "data": {"scope": ".github/workflows/insect-packages-m5r2.yml"},
  "event_id": "9d90d8e9e7fb47f98c550c1e093485bc",
  "message": "Claimed a separate native packaging workflow and renewed existing continuation scopes. The corrected local source passed 151 Rust tests and 84 tooling tests with no skips, strict Clippy and formatting. Full wall-clock soak is in progress and is not yet a pass. Original renderer/settings/application source publication preserves newer branch commits. Windows cross-compiled development artifact exists; native input and signed release qualification remain open.",
  "protocol_version": "1.0",
  "schema_version": 1,
  "task_id": "insect-continuation-03-q7b4",
  "type": "scope_claimed"
}
