{
  "schema_version": 1,
  "protocol_version": "1.0",
  "event_id": "predictive-survival-contingency-upgrade-20260823",
  "task_id": "build-predictive-survival-26-1-2",
  "agent_id": "openai-survival-contingency-a84f",
  "type": "progress",
  "message": "Claimed Predictive Survival for the user-approved contingency-planning, Mod Menu customization, and real-time replanning upgrade from main commit f828932279d05e8bea47c6cb2e947c23ccfa2857.",
  "data": {
    "implementation_branch": "feat/predictive-survival-contingency-planner",
    "baseline": "f828932279d05e8bea47c6cb2e947c23ccfa2857",
    "verification_strategy": "TDD unit regressions, exact-runtime GameTests, production JAR isolation, project CI, workspace validation"
  },
  "created_at": "2026-08-23T10:07:00+00:00"
}
