{
  "schema_version": 1,
  "protocol_version": "1.0",
  "event_id": "08032a4c132a45e5947f95543489d867",
  "task_id": "natural-aim-assist-fix-26-2-20260922",
  "agent_id": "openai-natural-aim-fix-26-2-9c2a",
  "type": "scope_released",
  "message": "Released .github/workflows/natural-aim-assist-26-2.yml: Natural Aim Assist 1.1.0 fixes implemented and fully verified.",
  "data": {
    "scope": ".github/workflows/natural-aim-assist-26-2.yml"
  },
  "created_at": "2026-09-22T21:55:05+00:00"
}
