{
  "schema_version": 1,
  "protocol_version": "1.0",
  "event_id": "predictive-survival-design-approved-20260817",
  "task_id": "design-predictive-survival-26-1-2",
  "agent_id": "openai-survival-exec-9b42",
  "type": "progress",
  "message": "Human approved the predictive survival design; implementation has moved to build-predictive-survival-26-1-2.",
  "data": {
    "design_branch": "design/predictive-survival-26-1-2",
    "plan_branch": "plan/predictive-survival-26-1-2",
    "implementation_task": "build-predictive-survival-26-1-2"
  },
  "created_at": "2026-08-17T18:06:11+00:00"
}
