{
  "schema_version": 1,
  "protocol_version": "1.0",
  "event_id": "a6d2releaseproject20260818",
  "task_id": "build-crystal-anchor-combat-optimizer-26-1-2",
  "agent_id": "openai-crystal-github-a6d2",
  "type": "release",
  "message": "Released project scope after verified implementation was merged into main.",
  "data": {
    "scope": "projects/crystal-anchor-combat-optimizer-26-1-2",
    "reason": "Implementation merged and task completed",
    "merge_commit": "e1d193f0e6aa7d0cab9fe60027554ecb47016f99"
  },
  "created_at": "2026-08-18T13:07:10+00:00"
}
