{
  "schema_version": 1,
  "protocol_version": "1.0",
  "event_id": "cb8d266ae3924b8abbf35cc2579273b5",
  "task_id": "natural-aim-pvp-authority-26-2-20260922",
  "agent_id": "openai-natural-aim-pvp-authority-26-2-7a3d",
  "type": "scope_released",
  "message": "Released projects/natural-aim-assist-26.2: Natural Aim Assist 1.1.3 PvP authority implemented and fully verified.",
  "data": {
    "scope": "projects/natural-aim-assist-26.2"
  },
  "created_at": "2026-09-22T23:11:32+00:00"
}
