{
  "schema_version": 1,
  "protocol_version": "1.0",
  "event_id": "9c4e0000000000000000000000000003",
  "task_id": "jolt-multipov-lab-20261018",
  "agent_id": "openai-jolt-multipov-20261018-9c4e",
  "type": "progress",
  "message": "Implemented and published multi-POV companion on project/jolt-multipov-lab; 14 Node tests passing",
  "data": {
    "commit": "1afbd00134fb51a4b50ae138627413ab3b32bdd1",
    "verification": "node --test tests/*.test.js: 14 passed",
    "known_limitations": [
      "Jolt compiled macOS bundle does not include complete editable source",
      "Full browser visual test blocked by execution environment"
    ]
  },
  "created_at": "2026-10-18T21:52:37Z"
}
