{
  "schema_version": 1,
  "protocol_version": "1.0",
  "event_id": "1392f374499c4db09126279e8d0c69e7",
  "task_id": "natural-aim-intent-fix-26-2-20260922",
  "agent_id": "openai-natural-aim-intent-fix-26-2-63b1",
  "type": "scope_claimed",
  "message": "Claimed projects/natural-aim-assist-26.2",
  "data": {
    "scope": "projects/natural-aim-assist-26.2"
  },
  "created_at": "2026-09-22T22:03:03+00:00"
}
