{
  "schema_version": 1,
  "protocol_version": "1.0",
  "event_id": "9461f1d8fe8b4d22ac47a619135e6704",
  "task_id": "design-speedbridge-breezily-silent-aim",
  "agent_id": "openai-breezily-design-c4e9",
  "type": "scope_claimed",
  "message": "Claimed the isolated design-document scope after user approval of the architecture, Breezily state machine, Automatic selection, and silent aim direction.",
  "data": {
    "scope": "tasks/design-speedbridge-breezily-silent-aim/artifacts/docs"
  },
  "created_at": "2026-08-01T17:30:00+00:00"
}
