{
  "agent_id": "openai-speedbridge-ci-a7f3",
  "created_at": "2026-08-01T15:07:12+00:00",
  "data": {
    "scope": "tasks/verify-speedbridge-assist-1-1-0/artifacts"
  },
  "event_id": "45f54b93fd4041b1ba80871451a8b26c",
  "message": "Released tasks/verify-speedbridge-assist-1-1-0/artifacts: CI verification completed and merged",
  "protocol_version": "1.0",
  "schema_version": 1,
  "task_id": "verify-speedbridge-assist-1-1-0",
  "type": "scope_released"
}
