{
  "schema_version": 1,
  "protocol_version": "1.0",
  "event_id": "secondary-expand-start-20260919T051500Z",
  "task_id": "insect-secondary-research-expand-20260919-r2",
  "agent_id": "sol-insect-secondary-expand-r2",
  "type": "task_started",
  "message": "Started empirical-data expansion and ant worker polymorphism research on top of the existing secondary-insect research lineage.",
  "data": {
    "base_branch": "feat/insect-secondary-research-20260919",
    "base_commit": "a081960d570d092ee6c1576d5e503e1f42e60e96",
    "runtime_changes": false,
    "target_empirical_bytes": 300000000
  },
  "created_at": "2026-09-19T05:15:00+00:00"
}
