{
  "agent_id": "openai-workspace-maint-b7e2",
  "created_at": "2026-08-01T16:18:13+00:00",
  "data": {
    "scope": ".agent-workspace.json"
  },
  "event_id": "7782d668009344a696ea937c3bc2edf4",
  "message": "Released .agent-workspace.json: hardening merged and CI verified",
  "protocol_version": "1.0",
  "schema_version": 1,
  "task_id": "harden-agent-workspace-after-first-run",
  "type": "scope_released"
}
